{
  "$schema": "paper-rig/paint-primitive-1",
  "schemaVersion": "1.0.0",
  "id": "faceBlaze",
  "semanticRole": "face.marking",
  "paletteRole": "body.marking",
  "detailTier": "identity",
  "geometry": {
    "type": "closedPath",
    "path": "M 0 -0.8 C 0.22 -0.45 0.18 0.2 0 0.65 C -0.18 0.2 -0.22 -0.45 0 -0.8 Z"
  }
}
